{
  "schema_version": "virtualization-ai.redhat-intel.com/qualification-request/v1",
  "correlation_id": "11111111-1111-4111-8111-111111111111",
  "guest": {"name": "contract-author-vm", "namespace": "virtualization-ai-201"},
  "task": "classify-operations-note",
  "note": "The application can resolve the adapter Service, but requests stop after the model boundary.",
  "allowed_categories": ["application", "capacity", "connectivity", "unknown"]
}
